{
  "video": {
    "duration": 24.0,
    "output_name": "music_ball_job_002"
  },
  "audio": {
    "note_mode": "next_note_on_trigger",
    "note_clips_dir": "note_clips/",
    "audio_delay_ms": 0,
    "loop_notes": true,
    "notes": [
      {
        "index": 0,
        "file": "note_0001.wav"
      },
      {
        "index": 1,
        "file": "note_0002.wav"
      },
      {
        "index": 2,
        "file": "note_0003.wav"
      },
      {
        "index": 3,
        "file": "note_0004.wav"
      },
      {
        "index": 4,
        "file": "note_0005.wav"
      },
      {
        "index": 5,
        "file": "note_0006.wav"
      },
      {
        "index": 6,
        "file": "note_0007.wav"
      },
      {
        "index": 7,
        "file": "note_0008.wav"
      },
      {
        "index": 8,
        "file": "note_0009.wav"
      },
      {
        "index": 9,
        "file": "note_0010.wav"
      },
      {
        "index": 10,
        "file": "note_0011.wav"
      },
      {
        "index": 11,
        "file": "note_0012.wav"
      },
      {
        "index": 12,
        "file": "note_0013.wav"
      },
      {
        "index": 13,
        "file": "note_0014.wav"
      },
      {
        "index": 14,
        "file": "note_0015.wav"
      },
      {
        "index": 15,
        "file": "note_0016.wav"
      },
      {
        "index": 16,
        "file": "note_0017.wav"
      },
      {
        "index": 17,
        "file": "note_0018.wav"
      },
      {
        "index": 18,
        "file": "note_0019.wav"
      },
      {
        "index": 19,
        "file": "note_0020.wav"
      },
      {
        "index": 20,
        "file": "note_0021.wav"
      },
      {
        "index": 21,
        "file": "note_0022.wav"
      },
      {
        "index": 22,
        "file": "note_0023.wav"
      },
      {
        "index": 23,
        "file": "note_0024.wav"
      },
      {
        "index": 24,
        "file": "note_0025.wav"
      },
      {
        "index": 25,
        "file": "note_0026.wav"
      },
      {
        "index": 26,
        "file": "note_0027.wav"
      },
      {
        "index": 27,
        "file": "note_0028.wav"
      },
      {
        "index": 28,
        "file": "note_0029.wav"
      },
      {
        "index": 29,
        "file": "note_0030.wav"
      },
      {
        "index": 30,
        "file": "note_0031.wav"
      },
      {
        "index": 31,
        "file": "note_0032.wav"
      },
      {
        "index": 32,
        "file": "note_0033.wav"
      },
      {
        "index": 33,
        "file": "note_0034.wav"
      },
      {
        "index": 34,
        "file": "note_0035.wav"
      },
      {
        "index": 35,
        "file": "note_0036.wav"
      },
      {
        "index": 36,
        "file": "note_0037.wav"
      },
      {
        "index": 37,
        "file": "note_0038.wav"
      },
      {
        "index": 38,
        "file": "note_0039.wav"
      },
      {
        "index": 39,
        "file": "note_0040.wav"
      },
      {
        "index": 40,
        "file": "note_0041.wav"
      },
      {
        "index": 41,
        "file": "note_0042.wav"
      },
      {
        "index": 42,
        "file": "note_0043.wav"
      },
      {
        "index": 43,
        "file": "note_0044.wav"
      },
      {
        "index": 44,
        "file": "note_0045.wav"
      },
      {
        "index": 45,
        "file": "note_0046.wav"
      },
      {
        "index": 46,
        "file": "note_0047.wav"
      },
      {
        "index": 47,
        "file": "note_0048.wav"
      },
      {
        "index": 48,
        "file": "note_0049.wav"
      },
      {
        "index": 49,
        "file": "note_0050.wav"
      },
      {
        "index": 50,
        "file": "note_0051.wav"
      },
      {
        "index": 51,
        "file": "note_0052.wav"
      },
      {
        "index": 52,
        "file": "note_0053.wav"
      },
      {
        "index": 53,
        "file": "note_0054.wav"
      },
      {
        "index": 54,
        "file": "note_0055.wav"
      },
      {
        "index": 55,
        "file": "note_0056.wav"
      },
      {
        "index": 56,
        "file": "note_0057.wav"
      },
      {
        "index": 57,
        "file": "note_0058.wav"
      },
      {
        "index": 58,
        "file": "note_0059.wav"
      },
      {
        "index": 59,
        "file": "note_0060.wav"
      },
      {
        "index": 60,
        "file": "note_0061.wav"
      }
    ]
  },
  "text": {
    "show_text": true,
    "top_text": "Can you guess this name music?",
    "bottom_text": "Stay till the end to find out!",
    "song_name": "Cupid - Fifty Fifty"
  },
  "job_assets": {
    "ball_icon_path": "res://assets/icons/Cupid.png",
    "ball_color": "#FF7043"
  }
}